[
  {
    "entry_id": "ro-vocab:zebra:noun:unqualified:r1",
    "revision": 1,
    "status": "draft",
    "disposition_reason": "Eligible source record awaiting original authoring and editorial review.",
    "source_ref": {
      "source_id": "cambridge-yle-2025",
      "word_id": "cyle25:v2:zebra:noun:unqualified",
      "source_schema_version": "2.0.0",
      "source_pdf_sha256": "6f7a0ad1e277bd10ae8b3bcccfb76c058f611a607c6c9947601abbd7e16a99fa"
    },
    "headword": "zebra",
    "display_forms": [
      "zebra"
    ],
    "part_of_speech": [
      "noun"
    ],
    "source_qualifier": null,
    "sense_label": "zebra (noun)",
    "level_metadata": {
      "first_listed_level": "Pre A1 Starters",
      "listed_at_levels": [
        "Pre A1 Starters"
      ]
    },
    "theme_ids": [
      "cyle25-theme:animals"
    ],
    "teaching": {
      "definition_en": null,
      "explanation_vi": null,
      "example_en": null,
      "example_vi": null,
      "nonexample_en": null,
      "contrast_entry_ids": [],
      "usage_notes": [],
      "pronunciation": {
        "ipa_uk": null,
        "ipa_us": null,
        "audio_uk": null,
        "audio_us": null,
        "syllable_hint": null
      },
      "visual": {
        "representation_type": "scene_svg",
        "visual_priority": "high",
        "asset_id": "vg-scene-zebra-v1",
        "asset": "vocabulary/assets/vg-scene-zebra-v1.svg",
        "alt": "A friendly zebra with bold black and white stripes, a standing mane and tufted tail, grazing on the African savanna with a tree behind.",
        "status": "draft",
        "kind": "scene",
        "template": null,
        "anchor_objects": []
      },
      "activity_templates": []
    },
    "review": {
      "language_review": "pending",
      "sense_review": "pending",
      "child_suitability_review": "pending",
      "media_review": "pending",
      "parent_approval": "pending"
    },
    "provenance": {
      "teaching_content_original": true,
      "source_attribution_internal_only": true
    }
  },
  {
    "entry_id": "ro-vocab:zero:noun:unqualified:r1",
    "revision": 1,
    "status": "draft",
    "disposition_reason": "Eligible source record awaiting original authoring and editorial review.",
    "source_ref": {
      "source_id": "cambridge-yle-2025",
      "word_id": "cyle25:v2:zero:noun:unqualified",
      "source_schema_version": "2.0.0",
      "source_pdf_sha256": "6f7a0ad1e277bd10ae8b3bcccfb76c058f611a607c6c9947601abbd7e16a99fa"
    },
    "headword": "zero",
    "display_forms": [
      "zero"
    ],
    "part_of_speech": [
      "noun"
    ],
    "source_qualifier": null,
    "sense_label": "zero (noun)",
    "level_metadata": {
      "first_listed_level": "A2 Flyers",
      "listed_at_levels": [
        "A2 Flyers"
      ]
    },
    "theme_ids": [],
    "teaching": {
      "definition_en": null,
      "explanation_vi": null,
      "example_en": null,
      "example_vi": null,
      "nonexample_en": null,
      "contrast_entry_ids": [],
      "usage_notes": [],
      "pronunciation": {
        "ipa_uk": null,
        "ipa_us": null,
        "audio_uk": null,
        "audio_us": null,
        "syllable_hint": null
      },
      "visual": {
        "representation_type": "no_visual_needed",
        "visual_priority": "none",
        "asset_id": null,
        "asset": null,
        "alt": null,
        "status": "not_applicable",
        "kind": "none",
        "template": null,
        "anchor_objects": []
      },
      "activity_templates": []
    },
    "review": {
      "language_review": "pending",
      "sense_review": "pending",
      "child_suitability_review": "pending",
      "media_review": "not_applicable",
      "parent_approval": "pending"
    },
    "provenance": {
      "teaching_content_original": true,
      "source_attribution_internal_only": true
    }
  },
  {
    "entry_id": "ro-vocab:zoe:proper-noun:unqualified:r1",
    "revision": 1,
    "status": "not_teachable_as_standalone",
    "disposition_reason": "Proper name / title: does not need an ordinary vocabulary lesson. Explicit disposition recorded.",
    "source_ref": {
      "source_id": "cambridge-yle-2025",
      "word_id": "cyle25:v2:zoe:proper-noun:unqualified",
      "source_schema_version": "2.0.0",
      "source_pdf_sha256": "6f7a0ad1e277bd10ae8b3bcccfb76c058f611a607c6c9947601abbd7e16a99fa"
    },
    "headword": "zoe",
    "display_forms": [
      "zoe"
    ],
    "part_of_speech": [
      "proper_noun"
    ],
    "source_qualifier": null,
    "sense_label": "zoe (proper_noun)",
    "level_metadata": {
      "first_listed_level": "A1 Movers",
      "listed_at_levels": [
        "A1 Movers"
      ]
    },
    "theme_ids": [
      "cyle25-theme:names"
    ],
    "teaching": {
      "definition_en": null,
      "explanation_vi": null,
      "example_en": null,
      "example_vi": null,
      "nonexample_en": null,
      "contrast_entry_ids": [],
      "usage_notes": [],
      "pronunciation": {
        "ipa_uk": null,
        "ipa_us": null,
        "audio_uk": null,
        "audio_us": null,
        "syllable_hint": null
      },
      "visual": {
        "representation_type": "no_visual_needed",
        "visual_priority": "none",
        "asset_id": null,
        "asset": null,
        "alt": null,
        "status": "not_applicable",
        "kind": "none",
        "template": null,
        "anchor_objects": []
      },
      "activity_templates": []
    },
    "review": {
      "language_review": "pending",
      "sense_review": "pending",
      "child_suitability_review": "pending",
      "media_review": "not_applicable",
      "parent_approval": "pending"
    },
    "provenance": {
      "teaching_content_original": true,
      "source_attribution_internal_only": true
    }
  },
  {
    "entry_id": "ro-vocab:zoo:noun:unqualified:r1",
    "revision": 1,
    "status": "draft",
    "disposition_reason": "Eligible source record awaiting original authoring and editorial review.",
    "source_ref": {
      "source_id": "cambridge-yle-2025",
      "word_id": "cyle25:v2:zoo:noun:unqualified",
      "source_schema_version": "2.0.0",
      "source_pdf_sha256": "6f7a0ad1e277bd10ae8b3bcccfb76c058f611a607c6c9947601abbd7e16a99fa"
    },
    "headword": "zoo",
    "display_forms": [
      "zoo"
    ],
    "part_of_speech": [
      "noun"
    ],
    "source_qualifier": null,
    "sense_label": "zoo (noun)",
    "level_metadata": {
      "first_listed_level": "Pre A1 Starters",
      "listed_at_levels": [
        "Pre A1 Starters"
      ]
    },
    "theme_ids": [
      "cyle25-theme:animals",
      "cyle25-theme:places-directions"
    ],
    "teaching": {
      "definition_en": null,
      "explanation_vi": null,
      "example_en": null,
      "example_vi": null,
      "nonexample_en": null,
      "contrast_entry_ids": [],
      "usage_notes": [],
      "pronunciation": {
        "ipa_uk": null,
        "ipa_us": null,
        "audio_uk": null,
        "audio_us": null,
        "syllable_hint": null
      },
      "visual": {
        "representation_type": "no_visual_needed",
        "visual_priority": "none",
        "asset_id": null,
        "asset": null,
        "alt": null,
        "status": "not_applicable",
        "kind": "none",
        "template": null,
        "anchor_objects": []
      },
      "activity_templates": []
    },
    "review": {
      "language_review": "pending",
      "sense_review": "pending",
      "child_suitability_review": "pending",
      "media_review": "not_applicable",
      "parent_approval": "pending"
    },
    "provenance": {
      "teaching_content_original": true,
      "source_attribution_internal_only": true
    }
  }
]
