[
  {
    "entry_id": "ro-vocab:x-ray:noun:unqualified:r1",
    "revision": 1,
    "status": "draft",
    "disposition_reason": "Eligible source record awaiting original authoring and editorial review.",
    "source_ref": {
      "source_id": "cambridge-yle-2025",
      "word_id": "cyle25:v2:x-ray:noun:unqualified",
      "source_schema_version": "2.0.0",
      "source_pdf_sha256": "6f7a0ad1e277bd10ae8b3bcccfb76c058f611a607c6c9947601abbd7e16a99fa"
    },
    "headword": "x-ray",
    "display_forms": [
      "x-ray"
    ],
    "part_of_speech": [
      "noun"
    ],
    "source_qualifier": null,
    "sense_label": "x-ray (noun)",
    "level_metadata": {
      "first_listed_level": "A2 Flyers",
      "listed_at_levels": [
        "A2 Flyers"
      ]
    },
    "theme_ids": [
      "cyle25-theme:health"
    ],
    "teaching": {
      "definition_en": null,
      "explanation_vi": null,
      "example_en": null,
      "example_vi": null,
      "nonexample_en": null,
      "contrast_entry_ids": [],
      "usage_notes": [],
      "pronunciation": {
        "ipa_uk": null,
        "ipa_us": null,
        "audio_uk": null,
        "audio_us": null,
        "syllable_hint": null
      },
      "visual": {
        "asset": null,
        "alt": null,
        "kind": "none"
      },
      "activity_templates": []
    },
    "review": {
      "language_review": "pending",
      "sense_review": "pending",
      "child_suitability_review": "pending",
      "media_review": "not_applicable",
      "parent_approval": "pending"
    },
    "provenance": {
      "teaching_content_original": true,
      "source_attribution_internal_only": true
    }
  }
]
